{
    "fieldNumber": "1",
    "title": "Customer",
    "name": "USAGE%3A ",
    "definition": " This field is required. ",
    "fieldNotes": [
        " The format and structure of this field is defined by ANSI in document ATIS-0300251 Codes for Identification of Service Providers for Information Exchange. ",
        "This code is established prior to the submission of  the ASR. ",
        "For the casual customer who does not have an IAC code, this field should reflect an entry of \"CUS\". The customer name should be entered in the CUS Tfield on the ASR. ",
        "The IAC designated in the CCNA field is the provider's contact for management of the access ordering/negotiation process for the life of the order.  When using \"CUS\", management of this process may be determined on an individual provider basis. ",
        "The CCNA is not intended to indicate the customer being billed for the access service.  This is reflected in the ACNA field on the ASR. "
    ],
    "validEntries": " IAC Code  CUS = Casual customer ",
    "validEntryNotes": " Valid IAC codes are maintained by  Telcordi a  Technologies. ",
    "usage": " CCNA -  Customer Carrier Name Abbreviation Identifies the COMMON LANGUAGE IAC code for the customer submitting the ASR and receiving the Confirmation Notice Form (CN). ",
    "usageNotes": " The format and structure of this field is defined by ANSI in document ATIS-0300251 Codes for Identification of Service Providers for Information Exchange. \nThis code is established prior to the submission of  the ASR. \nFor the casual customer who does not have an IAC code, this field should reflect an entry of \"CUS\". The customer name should be entered in the CUS Tfield on the ASR. \nThe IAC designated in the CCNA field is the provider's contact for management of the access ordering/negotiation process for the life of the order.  When using \"CUS\", management of this process may be determined on an individual provider basis. \nThe CCNA is not intended to indicate the customer being billed for the access service.  This is reflected in the ACNA field on the ASR.  VALID ENTRIES%3A IAC Code  CUS %3D  Casual customer \nValid IAC codes are maintained by  Telcordi a  Technologies.  USAGE%3A  This field is required. ",
    "fieldLength": "3",
    "dataCharacteristics": "Alpha"
}